Headline,URL,Publication Date,Author,Content
"Jay Slater suffered 'accidental death', inquest finds - all we learnt from hearing",https://news.sky.com/story/jay-slater-all-we-learnt-from-inquest-into-teenagers-death-in-tenerife-13400532,,Author not found,"The death of teenager Jay Slater has been ruled as ""accidental"" after an inquest.

The 19-year-old, from Oswaldtwistle, Lancashire, disappeared on 17 June 2024 on the Spanish island of Tenerife after attending the NRG music festival.

He was reported missing and, after an extensive search and rescue mission and significant media attention, his body was found a month later on 15 July.

Jay Slater's inquest as it happened

An inquest into the teenager's death took place on 24 and 25 July at Preston Coroner's Court, after first being adjournedin May.

Dr James Adeley, a senior coroner for Lancashire and Blackburn with Darwen, concluded that Mr Slater died ""an accidental death"". He said he fell while trying to descend a ravine, which resulted in fatal skull trauma.

Here is everything we learned from the inquests in May and July which heard from experts, friends who were on holiday with Mr Slater and a testimony from his mother Debbie Duncan.

Why happened during the inquest in May?

The first inquest heard from Home Office pathologist Dr Richard Shepherd, who said Mr Slater’s injuries were ""entirely consistent"" with a fall from a great height and gave an official cause of death as a head injury.

He said there was no suggestion that the teenager had been assaulted or restrained.

Toxicology expert Dr Stephanie Martin said traces of MDMA and MDA, commonly known as ecstasy, along with cocaine and alcohol, were also found in Mr Slater's body.

Dr James Adeley decided to adjourn the inquest to July after a number of witnesses who had been asked to give evidence could not be traced or were unable to attend.

Mr Slater's mother Ms Duncan told the court in May that she wanted ""these people to be sat in front of us, because our son went on holiday and didn't come back, so there's questions we need to ask"".

Slater took a mixture of drugs and alcohol

Bradley Geoghegan and Lucy Law, who were with Mr Slater on holiday, gave evidence to the court when it resumed in July.

Mr Geoghegan told the court the trio landed in Tenerife on 13 June last year and met up with their friend, Brandon Hodgson.

While they were out that night, the group met Ayoub Qassim and Stephen Roccus, who were staying at the Airbnb Mr Slater travelled to in the village of Masca, before his disappearance.

On the night of 16 June, the day before Mr Slater disappeared, Mr Geoghegan said he had taken ecstasy pills and possibly ketamine, along with cocaine and alcohol.

Mr Slater 'on the buzz' and 'happy' before disappearance

Appearing at the inquest via video link, Mr Qassim, who Mr Slater stayed with before he disappeared, described the teenager as ""on the buzz"" in the early hours of 17 June, the day he went missing.

At roughly 5am, after a night of partying, Mr Qassim was with Mr Slater and other friends going between a club and a food spot.

""Jay was on the buzz, head bopping, chill, happy, mingling innit,"" he told the coroner.

Asked if he would have trusted Mr Slater to drive a car in his state then, Mr Qassim said ""nah"".

Mr Qassim said Mr Slater had asked to come back to the Masca Airbnb where he and his friend Mr Roccas were staying as everyone else had left.

He told the inquest he went to bed when they returned and could hear Mr Slater downstairs.

He was woken about an hour later because he needed to move his car and when he returned to the house Mr Slater was leaving and said he was going to catch a bus.

Me Qassim said: ""I went 'bro, there ain’t no buses coming here any time soon'.""

He said Mr Slater left, despite him explaining that buses did not pass regularly.

""At that point I presumed he'd sit at that bus stop and that's it. He's waiting till the first bus comes and he's out of there.""

'I told him to chill… now he's gone missing'

When questioned by family barrister Lois Norris, if he can remember any calls he received on the day Mr Slater disappeared, Mr Qassaim said he only vividly remembers being told he had gone missing.

Pointing out he'd only slept for one hour - and that he had suggested to Mr Slater that he should stay at their place, rather than take a bus - Mr Qassim said: ""I'm sort of annoyed, thinking 'f****** hell I need some sleep.

""I said: 'Bro, I told him to chill, and now you're telling me he's gone missing'.""

Slater called friends before his phone died

Having left the Airbnb, it is believed Mr Slater attempted to make the 14-hour walk back to the main Veronicas Strip. During this walk, coroner Dr Adeley said the teenager called Brandon Hodgson ""laughing and joking"".

Moments later, he called Mr Geoghegan on Snapchat, during which he told Mr Slater to get a taxi.

Mr Geoghegan said: ""I said put your maps on to see how far you were. It was like a 14-hour walk or an hour drive. I said, 'Get a taxi back', then he just goes, 'I will ring you back'.""

Mr Slater then called Ms Law saying he didn't know where he was with mountains ""all around"".

He said he needed a drink and was ""frightened"" but said he could not go back to the Airbnb, without expanding on why.

Ms Law told the court: ""By this stage, I'm panicking.""

Lack of sleep, training, water and poor judgement

Excerpts of information from the Spanish authorities were read out in court by Dr Adeley, including from the local Mountain Rescue services.

It said on the 29th day of the search for Mr Slater, they took to the treacherous Juan Lopez Ravine, where his body was later found.

Please use Chrome browser for a more accessible video player

Chapters

descriptions off, selected

Captions settings, opens captions settings dialogCaptions off, selected

en (Main), selected

This is a modal window.

Beginning of dialog window. Escape will cancel and close the window.

End of dialog window.

This is a modal window. This modal can be closed by pressing the Escape key or activating the close button.

This is a modal window. This modal can be closed by pressing the Escape key or activating the close button.

Dr Adeley explained that the teenager's body was found eight metres above a dry stream bed, with mountain rescue crews estimating he fell between 20 and 25 metres.

""It was acknowledged the area was mountainous with inaccessible areas,"" Dr Adeley said in court.

The coroner says that there was ""very rough terrain"" at the point where the fall occurred.

He adds that factors contributing to Slater's fall were a lack of training, poor judgement, a lack of sleep and a lack of water.

'Our lives will never be the same'

Speaking at the inquest, Mr Slater's mother, Debbie Duncan, said the lives of their family will ""never be the same without Jay in it"".

""Not in a million years could we predict what was going to unfold,"" she said.

Read more from Sky News:How search for missing teenager captured nation's attentionInside the valley where Jay Slater's body was found

Listen to The World with Richard Engel and Yalda Hakim every Wednesday

""He was learning to drive and had so many plans and a bright future ahead of him.""

He ""touched the hearts of the nation"", Ms Duncan continued, asking that he be allowed to ""rest in eternal peace""."
Gregg Wallace speaks out after MasterChef sacking,https://news.sky.com/story/gregg-wallace-apologises-to-anyone-he-has-hurt-but-insists-im-not-a-groper-13401954,,Author not found,"Gregg Wallace has spoken about his sacking from MasterChef after inappropriate behaviour while working for the BBC - but insisted he is ""not a groper, a sex pest or a flasher"".

Wallace, 60, has apologised after a report, commissioned by the cooking show's production company Banijay UK, found45 out of 83 allegationswere substantiated.

In an interview withThe Sun, he said: ""I know I have said things that offended people... I understand that now - and to anyone I have hurt, I am so sorry.

""I don't expect anyone to have any sympathy with me but I don't think I am a wrong 'un.""

Please use Chrome browser for a more accessible video player

Chapters

descriptions off, selected

Captions settings, opens captions settings dialogCaptions off, selected

This is a modal window.

Beginning of dialog window. Escape will cancel and close the window.

End of dialog window.

This is a modal window. This modal can be closed by pressing the Escape key or activating the close button.

This is a modal window. This modal can be closed by pressing the Escape key or activating the close button.

MasterChef co-host John Torode also had an allegation thathe used an ""extremely offensive racist term""upheld, as part of the same investigation.

Torode, who insisted he had ""absolutely no recollection"" of the alleged incident, has not had his contract for the show renewed.

Wallace has now defended Torode, saying: ""I've known John for 30 years and he is not a racist.

More on Bbc

MasterChef series filmed last year to be broadcast after allegations against presenters upheldBBC reveals highest-earning stars - as pay list publishedHead of BBC addresses future of MasterChef - as annual report released

MasterChef series filmed last year to be broadcast after allegations against presenters upheld

BBC reveals highest-earning stars - as pay list published

Head of BBC addresses future of MasterChef - as annual report released

Related Topics:

BBCGregg Wallace

""There is no way that man is a ­racist. No way. And my sympathies go out to John because I don't want anybody to go through what I've been through.""

At one point, Wallace became tearful during the interview when describing the impact of the investigation on his family.

""I have seen myself written about in the same sentence asJimmy SavileandHuw Edwards, paedophiles and sex offenders. That is just so, so horrific.""

In respect to the specific allegation of unwanted touching, Wallace denied groping a woman and said that, while he was attempting to flirt with her, he did believe the contact it was consensual.

""She gave me her phone number. I considered that to be intimacy. It was 15 years ago. Me, drunk, at a party, with my hand on a girl's bum,"" he said.

He also accepted he had briefly appeared with a sock on his private parts in front of four colleagues in MasterChef studio. But he said his is not a flasher, and people were either ""amused or bemused"" but not distressed.

Read more from Sky News:Actor Micheal Ward charged with rapeJazz singer Dame Cleo Laine diesBBC reveals highest-earning stars

Follow our channel and never miss an update.

On the broader allegations about using inappropriate language, Wallace accepted the criticism and suggested that some of his conduct could be explained by his autism and his background.

""I know I am odd. I know I struggle to read people. I know people find me weird. Autism is a... registered disability. Just because you can't see it doesn't mean it's not real.""

Be the first to getBreaking News

Install the Sky News app for free

He also blamed his former career: ""I'm a greengrocer from Peckham. I thrived in Covent Garden's fruit and veg market. In that environment that is jovial and crude. It is learned behaviour.""

Wallace told the newspaper he is now scared to appear in public: ""I go out now in a disguise - a baseball cap and sunglasses, I don't want people to see me. I'm scared.""

On Wednesday, the BBC confirmeda series of MasterChef filmed last year, before allegations against presenters Gregg Wallace and John Torode were upheld, will still be broadcast."
Saturday's  national newspaper front pages,https://news.sky.com/story/wednesdays-national-newspaper-front-pages-12427754,,Author not found,Content not found.
"Turkey faces 'truly great disaster', warns Erdogan amid raging wildfires and sweltering temperatures across Europe",https://news.sky.com/story/turkey-faces-truly-great-disaster-warns-erdogan-amid-raging-wildfires-and-sweltering-temperatures-across-europe-13401785,,Author not found,"Disaster zones have been declared in two provinces of Turkey as new wildfires broke out on the Mediterranean coast.

Smoke billowed across the sky in the popular resort of Antalya, with homes evacuated in the city centre and elsewhere.

In the nearby city of Manavgat locals grabbed hoses and buckets to help firefighters, with aircraft dumping water from above.

Otherwildfiresstarted on Friday in Adana and Mersin, further east along the coast.

Be the first to getBreaking News

Install the Sky News app for free

Turkey'sinterior minister declared the western provinces of Izmir and Bilecik ""disaster areas"" aftera month of firesin the country.

PresidentRecep Tayyip Erdoganalso said on Friday that the country faced ""a truly great disaster"" and that 25,000 people were involved in the emergency effort.

More on Cyprus

Cyprus attorney general appeals after five Israeli men cleared of gang raping British tourist in Ayia NapaHow a British woman accused of lying about being gang-raped in Cyprus won a human rights caseWhy are 700 British troops being deployed to Cyprus?

Cyprus attorney general appeals after five Israeli men cleared of gang raping British tourist in Ayia Napa

How a British woman accused of lying about being gang-raped in Cyprus won a human rights case

Why are 700 British troops being deployed to Cyprus?

Related Topics:

CyprusExtreme WeatherHeatwaveTurkeyWildfires

Thirteen people have been killed so far, including 10 volunteers and forestry workers in the central Eskisehir province on Wednesday.

Cyprushas also been enduring one of its worst wildfires in living memory. Temperatures have reached 43C (109F) on the island this week.

Two people were found dead in their car on Wednesday and scores of homes have been destroyed.

Spain, Egypt, Jordan and Israel were providing assistance, and planes from the RAF base on the island were also helping.

Elsewhere in southern Europe, firefighters inAlbaniahave been dealing with a blaze in the mountainous forests near Elbasan.

The devastating fires come amid dry, sweltering temperatures in southern parts of the continent.

Greece'siconic Acropolis was forced to limit its hours this week as it approached the mid-40s, while there's also been intense heat in the Balkans.

And it's not only southern Europe that's been getting abnormal heat:Finlandbroke a record this week after experiencing 14 straight days above 30C.

The previous record of 13 days was set in 1972.

Read more from Sky News:East and West Midlands officially in drought - which areas could be next?Top Boy actor charged with two counts of rapeWhere are hosepipe bans in place and what does it mean?

Follow our channel and never miss an update.

Respite looks to be ahead, however, with many areas expected to cool to more usual levels next week.

Most experts attribute the above-average temperatures for this time of year to human-causedclimate changeand say wildfires are likely to become more frequent.

2024 was the warmest year on record, withtemperatures exceeding 1.5Cabove the pre-industrial era for the first time."
Top Boy actor Micheal Ward charged with two counts of rape,https://news.sky.com/story/top-boy-actor-micheal-ward-charged-with-two-counts-of-rape-13401772,,Author not found,"Top Boy actor Micheal Ward has been charged with two counts of rape and is due to appear in court next month.

Ward, 27, has also been charged with two counts of assault by penetration and one count of sexual assault.

The offences relate to one woman and are reported to have taken place in January 2023.

""Our specialist officers continue to support the woman who has come forward - we know investigations of this nature can have a significant impact on those who make reports,"" said Detective Superintendent Scott Ware, whose team is leading the Met Police's investigation.

Ward, of Cheshunt, Hertfordshire, is due to appear at Thames Magistrates' Court on 28 August, the Crown Prosecution Service said.

Ward said he denies the charges of rape and sexual assault, adding in a statement: ""I recognise that proceedings are now ongoing, and I have full faith that they will lead to my name being cleared.""

In a statement, Catherine Baccas, deputy chief crown prosecutor for CPS London South, said: ""We remind all concerned that proceedings against the suspect are active and he has a right to a fair trial.

More from Ents & Arts

Gregg Wallace speaks out after MasterChef sackingCompany at heart of Coldplay viral video releases tongue-in-cheek clip - with a big twistGrammy-winning jazz singer Dame Cleo Laine dies

Gregg Wallace speaks out after MasterChef sacking

Company at heart of Coldplay viral video releases tongue-in-cheek clip - with a big twist

Grammy-winning jazz singer Dame Cleo Laine dies

""It is vital that there should be no reporting, commentary or sharing of information online which could in anyway prejudice these proceedings.""

Ward starred in the popular Netflix series Top Boy as Jamie. He also appeared in films like Blue Story, The Old Guard and Empire of Light.

In 2020, the Jamaican-born actor was awarded the Bafta Rising Star honour in 2020.

Read more from Sky News:Teenagers jailed for 15 years for machete murderHome Office threaten asylum seekers with homelessness

Follow our channel and never miss an update

He was nominated for Best Supporting Actor Bafta in 2021 for his role as Franklyn in the BBC series Small Axe, and 2022 for his performance as Stephen in Empire of Light.

Ward is also in the upcoming American film Eddington alongside Joaquin Phoenix and Pedro Pascal, which is set to be released in the UK next month.

He has more than a million followers on Instagram and participated in charity events like the Soccer Aid match at Stamford Bridge last year.

Ward gave a reading at the Christmas Eve carol service hosted by the Princess of Wales in 2023."
Crime commissioner apologises for claiming 'dead bodies' found in woodland,https://news.sky.com/story/crime-commissioner-apologises-for-claiming-dead-bodies-found-in-woodland-13401975,,Author not found,"A police and crime commissioner has apologised after claiming multiple human remains had been found in woodland during a murder investigation.

Alison Hernandez told a meeting of the Devon and Cornwall police and crime panel ""dead bodies"" had been found at Sticker, near St Austell.

She said investigations were ongoing to establish exactly how many had been found.

But Devon and Cornwall Police said the body of one man had been recovered from the woods and no other remains had been found.

Police and forensic experts have been carrying out extensive inquiries in the woodland since the discovery of the body of 43-year-old Daniel Coleman.

James Desborough, 39, is accused of murdering Mr Coleman between 2 June and 7 July. He is due back before Truro Crown Court next week.

Apologising, Ms Hernandez said: ""In trying to be helpful I responded to an operational question at the police and crime panel, however, I was not fully up to date with the facts of the investigation.

""I apologise for any alarm this may have caused.

""The police have operational primacy over these matters.

""Any investigation will unfold rapidly and I was not in possession of all the facts at that time.""

Read more:25% of young children now malnourished in Gaza, charity saysTrump issues warning to leaders as he arrives in Scotland

Be the first to getBreaking News

Install the Sky News app for free

Devon and Cornwall Police rejected Ms Hernandez's claims, with Detective Superintendent Jon Bancroft saying: ""We currently have three separate murder investigations being conducted in the Cornwall area.

""I have oversight of all of these investigations at this time, and can confirm they are being carried out independently of each other and are not believed to be linked.

""I can categorically state that we have recovered remains believed to be those of Daniel Coleman only from an area of woodland in Sticker.

""No other remains have been located at this scene to date."""
"Ghislaine Maxwell answered justice department questions 'about 100 different people', her lawyer says",https://news.sky.com/story/ghislaine-maxwell-answered-justice-department-questions-about-100-different-people-her-lawyer-says-13401865,,Author not found,"Ghislaine Maxwell answered ""every single question"" from the US justice department, her lawyer has said.

The imprisoned former girlfriend of convicted sex offenderJeffrey Epsteinanswered questions ""about 100 different people"" during one-and-a-half days of questioning in the federal courthouse in Tallahassee, Florida, her attorney David Oscar Markus said.

A senior administration official has confirmed to Sky News' US partner, NBC News, that Maxwell was granted limited immunity, meaning the information could not be used against her in any future cases or proceedings.

Mr Markus said Maxwell ""answered those questions honestly, truthfully, to the best of her ability"" when she met with deputy attorney general Todd Blanche.

""She never invoked a privilege. She never refused to answer a question, so we're very proud of her,"" Mr Markus added.

Maxwell,who was jailed in 2022for luring young girls to massage rooms for Epstein to abuse, is currently serving a 20-year prison sentence.

Epstein, 66,was found dead in his cellat a Manhattan federal jail in August 2019 as he awaited trial on sex trafficking charges. His death was ruled a suicide.

His case has generated endless attention and conspiracy theories due to his and Maxwell's links to famous people like royals, presidents and billionaires, includingDonald Trump.

Mr Trump is facing ongoing questions about the Epstein case. He denied prior knowledge of Epstein's crimes and claimed he cut off their relationship long ago.

The deputy US attorney general, Mr Blanche, announced earlier this week that Maxwell would be interviewed because of Mr Trump's directive to gather and release any credible evidence about others who may have committed crimes.

Maxwell's lawyer, Mr Markus, praised Mr Blanche's approach.

""The deputy attorney general is seeking the truth. He asked every possible question, and he was doing an amazing job,"" he said.

Please use Chrome browser for a more accessible video player

Chapters

descriptions off, selected

Captions settings, opens captions settings dialogCaptions off, selectedEnglish

en (Main), selected

This is a modal window.

Beginning of dialog window. Escape will cancel and close the window.

End of dialog window.

This is a modal window. This modal can be closed by pressing the Escape key or activating the close button.

This is a modal window. This modal can be closed by pressing the Escape key or activating the close button.

Be the first to getBreaking News

Install the Sky News app for free

Maxwell's immunity from future proceedings is ""limited"" because it only covers her if she tells the truth. Typically, prosecutors will consider the defendant's cooperation in an investigation when recommending a lighter sentence as part of a plea deal.

But since Maxwell has already been convicted, it is not clear how she might benefit from the immunity.

Mr Markus said Maxwell did not receive anything in return for answering the questions, but he acknowledged that Mr Trump could pardon her. ""We hope he exercises that power in the right and just way,"" Mr Markus said.

When asked whether he had thought about a pardon or clemency for Maxwell, Mr Trump claimed he had not considered it.

""I'm allowed to do it, but it's something I have not thought about,"" he told reporters outside the White House.

He later shut down another question, saying: ""I don't want to talk about that.""

Read more from Sky News:Analysis: Trump hopes to escape Epstein controversyScots divided as Trump heads to Turnberry

Listen to The World with Richard Engel and Yalda Hakim every Wednesday

Meanwhile, Maxwell's family have suggested the disgraced British socialite could use ""government misconduct"" to challenge her imprisonment.

Her family have frequently claimed she ""did not receive a fair trial"", but legal appeals against her sex trafficking convictions have been rejected by the courts.

Judges previously dismissed arguments from Maxwell's lawyers that she ""should never have been prosecuted"" because of a""weird"" agreement drafted more than 15 years ago.

The family argue that Maxwell should have been protected under an agreement Epstein had entered with the US Department of Justice in 2007, which agreed not to prosecute any of his co-conspirators.

During her trial in 2021, Maxwell was described as ""dangerous"" by prosecutors, who told jurors about how she would entice vulnerable girls to go to Epstein's properties for him to sexually abuse.

In a statement, her family said: ""Our sister Ghislaine did not receive a fair trial. Her legal team continues to fight her case in the courts and will file its reply in short order to the government's opposition in the US Supreme Court."""
