Headline,URL,Publication Date,Author,Content
Over 200 MPs sign cross-party letter demanding Starmer recognise Palestine as a state,https://news.sky.com/story/mass-cross-party-letter-demands-starmer-recognise-palestine-as-a-state-13401496,,,"Sir Keir Starmer is under increasing pressure to recognise a Palestinian state, with 221 MPs signing a cross-party letter demanding he take the step.

The letter is being organised by theLabourbackbencher Sarah Champion, who also sits as the International Development Committee chair.

They write: ""British recognition of Palestine would be particularly powerful given its role as the author of the Balfour Declaration and the former Mandatory Power in Palestine.

""Since 1980 we have backed a two-state solution. Such a recognition would give that position substance as well as living up to a historic responsibility we have to the people under that Mandate.""

Explainer:What does recognising a Palestinian state mean?

Please use Chrome browser for a more accessible video player

Chapters

descriptions off, selected

Captions settings, opens captions settings dialogCaptions off, selectedEnglish

en (Main), selected

This is a modal window.

Beginning of dialog window. Escape will cancel and close the window.

End of dialog window.

This is a modal window. This modal can be closed by pressing the Escape key or activating the close button.

This is a modal window. This modal can be closed by pressing the Escape key or activating the close button.

Earlier this month, nearly 60 Labour MPs called onDavid Lammyand the Foreign Office to immediately recognise Palestine as a state in a private letter, but this new call shows how dissatisfied many still are with the government's refusal to change its stance on the issue.

More on Gaza

Scottish Labour MSPs heap pressure on Starmer to recognise Palestinian state25% of young children and pregnant women malnourished in Gaza, charity says, as PM vows to fly critical medical cases to UKSir Keir Starmer is caught between Trump, Macron and MPs over Palestine recognition

Scottish Labour MSPs heap pressure on Starmer to recognise Palestinian state

25% of young children and pregnant women malnourished in Gaza, charity says, as PM vows to fly critical medical cases to UK

Sir Keir Starmer is caught between Trump, Macron and MPs over Palestine recognition

Related Topics:

GazaSir Keir StarmerWar in Gaza

As Number 10 came under growing pressure, Sir Keir on Friday released a statement onGazacalling the ""appalling scenes"" in the Strip ""unrelenting"".

Israel has denied there is a food shortage in Gaza - despite earlier this week more than 100 aid agencies warning of mass starvation in Gaza - and claims it had to take control of the supply and distribution of aid because Hamas fighters have been stealing aid before it reached civilians. Hamas has denied this, as have some humanitarian groups, including USAID.

Talking about the need for a regional ""lasting peace"", the prime minister said: ""Recognition of a Palestinian state has to be one of those steps. I am unequivocal about that. But it must be part of a wider plan which ultimately results in a two-state solution and lasting security for Palestinians and Israelis.""

Read more:British surgeon claims IDF shooting Gazans in specific areasFrance to become first G7 nation to recognise Palestine as a stateDozens of MPs call for UK to recognise Palestine as a state

Please use Chrome browser for a more accessible video player

Chapters

descriptions off, selected

Captions settings, opens captions settings dialogCaptions off, selectedEnglish

en (Main), selected

This is a modal window.

Beginning of dialog window. Escape will cancel and close the window.

End of dialog window.

This is a modal window. This modal can be closed by pressing the Escape key or activating the close button.

This is a modal window. This modal can be closed by pressing the Escape key or activating the close button.

In light of a tweet by the French PresidentEmmanuel Macron, also sent last night, declaring Francewould recognise a Palestinian statein September at a UN conference, a number of MPs now say Number 10's current position is untenable.

""They had said they wanted to be in lockstep with allies, but this means that position won't hold,"" said one Labour MP.

Please use Chrome browser for a more accessible video player

Chapters

descriptions off, selected

Captions settings, opens captions settings dialogCaptions off, selectedEnglish

en (Main), selected

This is a modal window.

Beginning of dialog window. Escape will cancel and close the window.

End of dialog window.

This is a modal window. This modal can be closed by pressing the Escape key or activating the close button.

This is a modal window. This modal can be closed by pressing the Escape key or activating the close button.

US President Donald Trump, speaking to reporters at the White House before heading to Scotland, was dismissive of Mr Macron's statement. ""What he says doesn't matter,"" he said. ""He's a very good guy. I like him, but that statement doesn't carry weight.""

Israeli Prime Minister Benjamin Netanyahu said: ""We strongly condemn President Macron's decision to recognise a Palestinian state next to Tel Aviv in the wake of the October 7 massacre. Such a move rewards terror and risks creating another Iranian proxy, just as Gaza became.

""A Palestinian state in these conditions would be a launch pad to annihilate Israel - not to live in peace beside it.

Peter Kyle, the technology secretary, on Friday morning defended the government's resistance to calls for immediate UK recognition of a Palestinian state.

""We want Palestinian statehood. We desire it, and we want to make sure the circumstances can exist where that kind of long-term political solution can have the space to evolve and make sure that it can become a permanent circumstance that can bring peace to the entire region,"" he told Sky News.

""But right now, today, we've got to focus on what will ease the suffering, and it is extreme, unwarranted suffering in Gaza that has to be the priority for us today.""

Please use Chrome browser for a more accessible video player

Chapters

descriptions off, selected

Captions settings, opens captions settings dialogCaptions off, selectedEnglish

en (Main), selected

This is a modal window.

Beginning of dialog window. Escape will cancel and close the window.

End of dialog window.

This is a modal window. This modal can be closed by pressing the Escape key or activating the close button.

This is a modal window. This modal can be closed by pressing the Escape key or activating the close button.

An emergency call with Germany and France was scheduled for Friday to discuss what Sir Keir described as a ""human catastrophe"" which has ""reached new depths"".

The Foreign Office has maintained it is committed to recognising a Palestinian state but has expressed a willingness to do so only when it will have the ""most impact in support of a peace process"".

It said: ""We continue to provide lifesaving aid to support Palestinians in Gaza and the West Bank, and to work closely in support of the Palestinian Authority."""
Israel allows foreign countries to parachute aid into Gaza,https://news.sky.com/story/israel-allows-foreign-countries-to-parachute-aid-into-gaza-13401638,,Communities correspondent,"Israel has said foreign countries can drop aid into Gaza from today.

A senior IDF official told Sky News on Friday: ""Starting today, Israel will allow foreign countries to parachute aid intoGaza.

""Starting this afternoon, the WCK organisation began reactivating its kitchens.""

Sir Keir Starmer has said the UK will now ""do everything we can"" to get supplies in via this route, but said this decision has come ""far too late"".

Latest: Starmer to have 'emergency' Gaza call with France and Germany

Please use Chrome browser for a more accessible video player

Chapters

descriptions off, selected

Captions settings, opens captions settings dialogCaptions off, selectedEnglish

en (Main), selected

This is a modal window.

Beginning of dialog window. Escape will cancel and close the window.

End of dialog window.

This is a modal window. This modal can be closed by pressing the Escape key or activating the close button.

This is a modal window. This modal can be closed by pressing the Escape key or activating the close button.

Humanitarian aid organisation World Central Kitchenpaused its operationin Gaza in November after a number of its workers were killed in an Israeli airstrike last year.

Aid workers in Gaza - who help provide food, medicine and shelter for the millions displaced there - have been affected by the ongoing conflict between Israel andHamas.

The Gaza Humanitarian Foundation - anIsraeland US-backed organisation - has been distributing food packages in Gaza since the end of May, after Israel eased its 11-week blockade of aid into the territory.

More than 1,000 peoplehave reportedly been killedwhiletrying to receive food aidsince then, according to the UN, with the territory facing a starvation crisis.

Gaza's Hamas-run health ministry said on Friday that nine people have died of malnutrition in the past 24 hours.

In a post on Facebook, the ministry said a total of 122 people, including 83 children, have died because of a lack of food since the war began.

In the first two weeks of July, the UN children's agency UNICEF treated 5,000 children facing acute malnutrition in the Strip.

On Friday, the UN warned that Gaza was running out of specialised therapeutic foods to treat malnourished children.

Aid was air-dropped into the territory from military planes last year by countries, including Jordan, the US and the UK via the Royal Air Force, but humanitarian organisations warned it wasn't enough.

It is also a potentially dangerous way to deliver supplies, and in March 2024, five people were killed when an aid parachute failed and a parcel fell on them.

Communities correspondent

Israel says there is no famine in Gaza – so why is it sanctioning an urgent international aid drop by air, particularly when doing so safely also means having a temporary pause in its bombardment of Gaza.

The reality is – whatever the public message – Israel must be feeling the intense pressure from the international community and global aid organisations to ease its blockade.

The UN secretary-general has said starvation is knocking on every door in Gaza.  The F word – famine – is even being talked about on Israeli television channels.

We understand the Jordanian government is discussing playing a role in the aid drop and we already know that the UN says there is enough food stockpiled in Egypt and Jordan to feed Gazans for three months.

Yet it hasn't reached hungry mouths in Gaza because Israel stands accused of making it simply too difficult to transport aid by road around a dangerous conflict zone for organisations, including the UN, which are trying to step in in the face of claims that the main sites run by the Gaza Humanitarian Foundation have turned into ""death traps"".

Dropping large aid packages may be the quickest way to get food into Gaza, given the circumstances, but it is also very dangerous, because of the scramble that ensues amongst people trying to reach the supplies.

However, this sign of movement in the aid crisis comes after a desperate week for Gazans fighting to survive hunger in a war zone.

Israel will remind the world it stopped the old ways of aid distribution because it says aid was falling into the hands of the militant group Hamas, still holding 20 living Israeli hostages.

There have also been reports of people drowning while trying to reach supplies that had fallen into the sea.

Israel has been at war with Hamas in Gaza since the Palestinian militant grouprampaged through southern Israel, killing 1,200 people,and taking around 250 hostage,on 7 October 2023.

Israel has denied there is a food shortage in Gaza - despite earlier this week more than 100 aid agencies warning of mass starvation in Gaza - and claims it had to take control of the supply and distribution of aid because Hamas fighters have been stealing aid before it reached civilians. Hamas has denied this, as have some humanitarian groups, including USAID.

Responding to reports the IDF had previously fired at civilians while they tried to access aid in Gaza, the IDF said it ""categorically rejects the claims of intentional harm to civilians"". It added: ""For the sake of clarity, the army's binding orders prohibit forces operating in the area from intentionally firing at civilians.""

Read more:People in Gaza are 'walking corpses'Recognise Palestine, Starmer urgedIDF 'shooting Gazans in specific areas'

Please use Chrome browser for a more accessible video player

Chapters

descriptions off, selected

Captions settings, opens captions settings dialogCaptions off, selectedEnglish

en (Main), selected

This is a modal window.

Beginning of dialog window. Escape will cancel and close the window.

End of dialog window.

This is a modal window. This modal can be closed by pressing the Escape key or activating the close button.

This is a modal window. This modal can be closed by pressing the Escape key or activating the close button.

It said: ""We are aware of reports of casualties among those who arrived at the aid distribution sites. These incidents are under examination by the relevant IDF authorities. Any allegation of a violation of the law or regulations will be thoroughly investigated, including taking appropriate action if necessary.

Please use Chrome browser for a more accessible video player

Chapters

descriptions off, selected

Captions settings, opens captions settings dialogCaptions off, selectedEnglish

en (Main), selected

This is a modal window.

Beginning of dialog window. Escape will cancel and close the window.

End of dialog window.

This is a modal window. This modal can be closed by pressing the Escape key or activating the close button.

This is a modal window. This modal can be closed by pressing the Escape key or activating the close button.

""The IDF is working to facilitate and ease the distribution of humanitarian aid in the Gaza Strip by the Gaza Humanitarian Foundation (GHF) at the designated distribution centres, as well as through other international actors. These efforts are being conducted under difficult and complex operational conditions. As part of its operational conduct, the IDF draws lessons and conducts systematic learning processes in order to improve its operational response."""
"Waves, surprising songs and question-dodging: Trump's golfing visit to Scotland in full 'swing'",https://news.sky.com/video/waves-surprising-songs-and-question-dodging-trumps-golfing-visit-to-scotland-in-full-swing-13402116,,Author not found,Content not found.
Teenage maurderers run after killing 14-year-old boy in London machete attack,https://news.sky.com/video/teenage-maurderers-run-after-killing-14-year-old-boy-in-london-machete-attack-13401976,,Author not found,Content not found.
Why are some UK MPs angry with Sir Keir Starmer over Gaza?,https://news.sky.com/video/why-are-some-uk-mps-angry-with-sir-keir-starmer-over-gaza-13401945,,Author not found,Content not found.
Keir Starmer says 'humanitarian catastrophe in Gaza must end',https://news.sky.com/video/keir-starmer-says-humanitarian-catastrophe-in-gaza-must-end-13402000,,Author not found,Content not found.
Doctors are issuing warnings over illegal Botox-like injections - here's how to avoid them,https://news.sky.com/video/doctors-are-issuing-warnings-over-illegal-botox-like-injections-heres-how-to-avoid-them-13401822,,Author not found,Content not found.
Kids visit beach for first time as the number of parents who can't afford school trips rises,https://news.sky.com/video/kids-visit-beach-for-first-time-as-the-number-of-parents-who-cant-afford-school-trips-rises-13399778,,Author not found,Content not found.
Spike in botulism cases linked to illegal Botox-like injections,https://news.sky.com/video/spike-in-botulism-cases-linked-to-illegal-botox-like-injections-13401729,,Author not found,Content not found.
Turkey wildfires: Disaster zones declared,https://news.sky.com/video/turkey-wildfires-disaster-zones-declared-13401792,,Author not found,Content not found.
"Jay Slater suffered 'accidental death', inquest finds",https://news.sky.com/video/jay-slater-suffered-accidental-death-inquest-finds-13401901,,Author not found,Content not found.
Sarina Wiegman on the Euros final and The Lionesses as campaigners,https://news.sky.com/video/sarina-wiegman-on-the-euros-final-and-the-lionesses-as-campaigners-13401926,,Author not found,Content not found.
Donald Trump arrives for Scotland visit,https://news.sky.com/video/donald-trump-arrives-for-scotland-visit-13401907,,Author not found,Content not found.
Donald Trump: 'I like your Prime Minister',https://news.sky.com/video/donald-trump-i-like-your-prime-minister-13401900,,Author not found,Content not found.
War in Gaza: 'This is a man-made starvation',https://news.sky.com/video/war-in-gaza-this-is-a-man-made-starvation-13401306,,Author not found,Content not found.
What are the new online rules? Sky's Mickey Carroll explains,https://news.sky.com/video/what-are-the-new-online-rules-skys-mickey-carroll-explains-13401533,,Author not found,Content not found.
Evacuees discuss 'scary' conflict between Thailand and Cambodia,https://news.sky.com/video/hub-lynch-thailand-v3-mp4-13401633,,Author not found,Content not found.
Trump unveils plan to win AI race - but is it a 'tech bro' manifesto?,https://news.sky.com/video/trump-unveils-plan-to-win-ai-race-but-is-it-a-tech-bro-manifesto-13401256,,Author not found,Content not found.
Fears of wider conflict sparked by Thailand and Cambodia border clashes,https://news.sky.com/video/fears-of-wider-conflict-sparked-by-thailand-and-cambodia-border-clashes-13401212,,Author not found,Content not found.
Sky's Neville Lazarus looks at how good the new UK-India free trade deal really is,https://news.sky.com/video/skys-neville-lazarus-looks-at-how-good-the-new-uk-india-free-trade-deal-really-is-13401121,,Author not found,Content not found.
Resident doctors' strike explained,https://news.sky.com/video/resident-doctors-strike-explained-13400779,,Author not found,Content not found.
Euro 2025: What next for England's comeback queens?,https://news.sky.com/video/euro-2025-what-next-for-englands-comeback-queens-13400607,,Author not found,Content not found.
Who is Howard Phillips - the British man found guilty of volunteering to spy for Russia?,https://news.sky.com/video/who-is-howard-phillips-the-british-man-found-guilty-of-volunteering-to-spy-for-russia-13400231,,Author not found,Content not found.
The group making a whites-only community in Arkansas,https://news.sky.com/video/the-group-making-a-whites-only-community-in-arkansas-13399835,,Author not found,Content not found.
Sky's Alex Crawford describes 'shocking' conditions of Syria hospital,https://news.sky.com/video/skys-alex-crawford-describes-shocking-conditions-of-syria-hospital-13399909,,Author not found,Content not found.
Man deported under Trump policy recalls 'constant beatings' in El Salvador prison,https://news.sky.com/video/man-deported-under-trump-policy-recalls-constant-beatings-in-el-salvador-prison-13400939,,Author not found,Content not found.
Prince George celebrates his 12th birthday with siblings in new royal video,https://news.sky.com/video/prince-george-celebrates-his-12th-birthday-with-siblings-in-new-royal-video-13400272,,Author not found,Content not found.
"Macron's statement on Palestine 'doesn't carry any weight', says Donald Trump",https://news.sky.com/video/macrons-statement-on-palestine-doesnt-carry-any-weight-says-donald-trump-13401738,,Author not found,Content not found.
Israeli military show journalists aid waiting inside Gaza as UN says people dying of hunger,https://news.sky.com/video/israeli-military-show-journalists-aid-waiting-inside-gaza-as-un-says-people-dying-of-hunger-13401435,,Author not found,Content not found.
TV cop helps arrest real-life thief,https://news.sky.com/video/tv-cop-helps-arrest-real-life-thief-13401445,,Author not found,Content not found.
'The war changed me': Malnutrition grips children in Gaza,https://news.sky.com/video/the-war-changed-me-malnutrition-grips-children-in-gaza-13401284,,Author not found,Content not found.
What do people think of Donald Trump's golf trip to Scotland?,https://news.sky.com/video/what-do-people-think-of-donald-trumps-golf-trip-to-scotland-13401254,,Author not found,Content not found.
CEO of Astronomer resigns after Coldplay concert video,https://news.sky.com/video/ceo-of-astronomer-resigns-after-coldplay-concert-video-13399028,,Author not found,Content not found.
Asylum hotels: Epping reacts as police deny protest claims,https://news.sky.com/video/asylum-hotels-epping-reacts-as-police-deny-protest-claims-13400903,,Author not found,Content not found.
Moment killer Daniel Gunter was arrested as father found guilty of murdering two-week old son in hospital,https://news.sky.com/video/moment-killer-daniel-gunter-was-arrested-as-father-found-guilty-of-murdering-two-week-old-son-in-hospital-13401259,,Author not found,Content not found.
Jeremy Corbyn and Zahra Sultana have launched a new party - What do we know?,https://news.sky.com/video/jeremy-corbyn-and-zahra-sultana-have-launched-a-new-party-what-do-we-know-13401369,,Author not found,Content not found.
Who is England's teenage superstar Michelle Agyemang?,https://news.sky.com/video/who-is-englands-teenage-superstar-michelle-agyemang-13400771,,Author not found,Content not found.
Trump Scotland visit: Thousands of police set to line the streets in 'significant operation',https://news.sky.com/video/trump-scotland-visit-thousands-of-police-set-to-line-the-streets-in-significant-operation-13400186,,Author not found,Content not found.
Who are the Druze and Bedouin groups that are fighting in Syria?,https://news.sky.com/video/who-are-the-druze-and-bedouin-groups-that-are-fighting-in-syria-13399904,,Author not found,Content not found.
What's the deal with wealth taxes?,https://news.sky.com/video/whats-the-deal-with-wealth-taxes-13399792,,Author not found,Content not found.
'Let's be kind!: Harry Potter actress Miriam Margolyes calls for inclusivity regarding J K Rowling transgender row,https://news.sky.com/video/lets-be-kind-harry-potter-actress-miriam-margolyes-calls-for-inclusivity-regarding-j-k-rowling-transgender-row-13400078,,Author not found,Content not found.
Water: Landmark report into 'broken' water industry - what you need to know,https://news.sky.com/video/water-landmark-report-into-broken-water-industry-what-you-need-to-know-13399781,,Author not found,Content not found.
